{
  "artifact_id": "src_meta_yates-giordano-bruno-1964",
  "artifact_type": "source_metadata",
  "schema_version": "1.0",
  "source_id": "yates-giordano-bruno-1964",
  "generated_at": "2026-06-14T00:00:00Z",
  "generated_by": "scripts/artifact_pipeline.py",
  "source_type": "pdf",
  "source_title": "Giordano Bruno and the Hermetic Tradition",
  "authors": ["Frances A. Yates"],
  "editors": [],
  "publication_date": "1964",
  "publication_year": 1964,
  "publisher": "Routledge and Kegan Paul",
  "source_uri": null,
  "local_path": "Frances A Yates Giordano Bruno and the Hermetic Tradition.pdf",
  "ingestion_date": "2026-06-14T00:00:00Z",
  "language": "en",
  "page_count": null,
  "rights_status": "in-copyright",
  "access_notes": "Physical copy in local corpus. Text extraction via PyMuPDF.",
  "raw_text_available": true,
  "transcript_available": false,
  "db_document_id": null,
  "notes": "Foundational text for the 'Yates thesis': that Renaissance Hermetism was a catalyst for the Scientific Revolution. Heavily critiqued by subsequent scholarship (Copenhaver, Vickers, Hanegraaff). Used here as a fixture example because it is central to the project's historiographical frame and already in the corpus."
}
